{
  "unit_id": "MUS-U-2027-W02",
  "annual_id": "MOS-MUSIC-ANNUAL-2027",
  "mos_week": "W02",
  "bible_passage": "路4:22–30",
  "core_truth": "恩典的主被自己的家乡拒绝——因为人想得到一位「先给我们」的耶稣，却容不下一位施恩给谁就施恩给谁的基督。",
  "theology": "神是恩典的主，施恩给谁由祂自己决定，不受血缘、地缘、资历与民族限制。人是会称赞恩典却拒绝恩典主权的人。自义与排他是把神的主权收进人的边界；被家乡弃绝的耶稣仍然往前走，救恩向外扩展。",
  "music_theme": [
    "MM16",
    "MM20"
  ],
  "core_song": "MUS-S-0002",
  "song_selection_rationale": "顺序：经文真理（恩典主权越过围墙）→ 神学（神主权不受人的掌控）→ MM16/MM20 → 功能（EM：信靠）→ 《我灵镇静》。这首歌不直译「接纳外人」，而是把「谁作主」交还给神——正是「先给我们」心态的解药。歌曲与经文的贴合度是间接而非直译，已在神学审查中标注。",
  "music_function": {
    "primary": "EM",
    "secondary": [
      "CO"
    ]
  },
  "seven_step_method": {
    "S1_read": {
      "label": "读",
      "prompt": "阅读或聆听本周经文，先不急着应用。",
      "content": "读路4:22–30：留意同一群人前一刻「称赞」后一刻「想把祂推下山崖」，找出转变的转折句（耶稣举的两个外邦人例证）。",
      "content_status": "reviewed"
    },
    "S2_understand": {
      "label": "明",
      "prompt": "这段经文究竟教导什么？",
      "content": "这段教导的核心是恩典的主权：施恩给谁由主自己决定，不受血缘、地缘、资历限制。「先给我们」是一种所有权式的罪——把神的恩典据为己有。被家乡拒绝的耶稣仍然往前走：恩典的主权与恩典的普及同时成立。",
      "content_status": "reviewed"
    },
    "S3_sing": {
      "label": "唱",
      "prompt": "通过歌曲表达已经理解的真理。",
      "content": "唱《我灵镇静》第一节（歌词见教会诗本或授权来源）：歌中那位「不凭眼见仍掌权的主」，正是本段拒绝被 local 化的恩典之主。唱的时候想一想：我是否也想把恩典圈在自己人里面？",
      "content_status": "reviewed"
    },
    "S4_remember": {
      "label": "记",
      "prompt": "本周希望门徒记住什么？",
      "content": "记住一句话：「施恩的主权在神手里，不在我的掌控里。」（对应经文：路4:25–27）",
      "content_status": "reviewed"
    },
    "S5_feel": {
      "label": "感",
      "prompt": "真理应该形成怎样的情感回应？",
      "content": "让真理塑造的情感是：对恩典主权的敬畏与信靠——既不再焦虑地争「资格」，也不轻看任何「圈外人」。若唱完只觉得平静而未触碰自己对某类人的排斥，回到 S2 重读两个外邦人例证。",
      "content_status": "reviewed"
    },
    "S6_act": {
      "label": "行",
      "prompt": "本周要完成的一个具体行动。",
      "content": "本周主动向一位「圈外人」表达一次具体接纳：邀请一位平时不来往的肢体（不同背景、口音、年龄层）吃饭或喝茶；若你是组长，检查本组分座分组的习惯，本周坐到最边缘的人旁边。",
      "content_status": "reviewed"
    },
    "S7_transmit": {
      "label": "传",
      "prompt": "本周要把什么传给别人？",
      "content": "用一句你自己的话向家人解释「恩典没有围墙」（例如：神的恩典不查户口），并讲一个拿撒勒会堂的故事给他们听。",
      "content_status": "reviewed"
    }
  },
  "life_practice": "本周向一位「圈外人」作一次具体接纳行动（约餐、问候或换座），不以同类为由拒绝任何人进入恩典群体。",
  "transmission_task": "向家人或组员用自己的话解释「恩典没有围墙」，并复述一个外邦人例证（寡妇或乃缦）。",
  "expected_formation": "门徒识别并放弃至少一个「恩典只给我们」的心态；一周内出现一次对圈外人的具体接纳行动；能复述一个外邦人例证。",
  "feedback": {
    "focus": [
      "理解",
      "实践",
      "群体"
    ],
    "question": "组员能否说出自己里面的「先给我们」倾向？本周的接纳行动指向了谁？"
  },
  "review_gate": {
    "theological_review": "needs_human_review",
    "song_relation": "theme_response",
    "theological_risk": "歌曲的「安静/信靠」若取代经文中「恩典突破边界」的主线，会众可能只记住平静而未触碰对圈外人的排斥——唱了主权的歌却没进入接纳的行。",
    "practice_conversion": "S6 已指定行动对象（一位圈外人）、行动内容（约餐/问候/换座）、时间（本周）与方式（组长检查分座分组习惯），四要素齐全，不退化为抽象属灵愿望。",
    "transmission_conversion": "S7 要求用自己的话向家人解释「恩典没有围墙」并复述一个外邦人例证——把记忆句传递给另一个人，可查验。",
    "note": "《我灵镇静》与 W02 是主题级（恩典主权）呼应而非经文直译，Song_Relation=Theme_Response；保持 Under Review，不得升级为 Core。若人工审核认为需要更直接表达「恩典越围墙」的歌曲，应换曲而非削足适履。"
  },
  "provenance": {
    "source_system": "mos-sermon-2027",
    "source_id": "2027-W02",
    "source_field": "经文中心+神学与福音辨识",
    "copy_policy": "derived_draft",
    "note": "单元内容为 MOS-MUSIC 基于正式释经的样本编排。"
  }
}
