{
  "unit_id": "MUS-U-2027-W03",
  "annual_id": "MOS-MUSIC-ANNUAL-2027",
  "mos_week": "W03",
  "bible_passage": "路5:1–11",
  "core_truth": "耶稣在人的徒劳与专业之外显出祂的主权，使人看见自己的不配，并把跟随的呼召交给他——跟从始于认识祂是谁，而不是因着得着什么。",
  "theology": "主主动临到、有权柄吩咐、并以「不要怕」安慰人。人的自我依靠（「我整夜劳力」）不是懒惰，而是把自己当作人生的主人。呼召的结构是：神主动显现→人认识不配→神差遣→跟随。撇下是认识主的结果，不是换取恩典的代价。",
  "music_theme": [
    "MM08"
  ],
  "core_song": "MUS-S-0003",
  "song_selection_rationale": "顺序：经文真理（呼召与撇下跟随）→ 神学（先认识主、后撇下）→ MM08 → 功能（LI：具体顺服）→ 《耶稣呼召》。歌的主语是「耶稣呼召」，保住了呼召的基督论起点；辅助《一切全献上》把降服变成承诺句，但必须挂在「先认识主」的次序上，防止道德主义。",
  "music_function": {
    "primary": "LI",
    "secondary": [
      "EM",
      "TR"
    ]
  },
  "seven_step_method": {
    "S1_read": {
      "label": "读",
      "prompt": "阅读或聆听本周经文，先不急着应用。",
      "content": "读路5:1–11：分四步读——①耶稣借船讲道；②「开到水深之处，下网打鱼」；③彼得的认罪与耶稣的「不要怕」；④「撇下所有的，跟从了耶稣」。",
      "content_status": "reviewed"
    },
    "S2_understand": {
      "label": "明",
      "prompt": "这段经文究竟教导什么？",
      "content": "注意次序：先认识主（满网鱼让彼得看见祂是谁），才有认罪与呼召，最后才是撇下。跟随的成本不是重点，主的身份才是。「依从你的话」发生在整夜劳力一无所得之后——顺服不是效率判断，而是主权判断。",
      "content_status": "reviewed"
    },
    "S3_sing": {
      "label": "唱",
      "prompt": "通过歌曲表达已经理解的真理。",
      "content": "唱《耶稣呼召》（歌词见教会诗本或授权来源）：歌的每一节正是「在繁忙与得失中听见呼召—放下—跟从」。再唱《一切全献上》副歌，把降服从情绪变成一句可执行的话。",
      "content_status": "reviewed"
    },
    "S4_remember": {
      "label": "记",
      "prompt": "本周希望门徒记住什么？",
      "content": "记住一句话：「跟从始于认识祂是谁，而不是因着得着什么。」（对应经文：路5:10–11）",
      "content_status": "reviewed"
    },
    "S5_feel": {
      "label": "感",
      "prompt": "真理应该形成怎样的情感回应？",
      "content": "让真理塑造的情感是：在圣洁主面前的谦卑（「主啊，离开我，我是个罪人」）与被「不要怕」托住的勇气。警惕两种假情感：没有认罪的亢奋，和没有「不要怕」的恐惧。",
      "content_status": "reviewed"
    },
    "S6_act": {
      "label": "行",
      "prompt": "本周要完成的一个具体行动。",
      "content": "本周完成一项「已经知道该做、却一直拖延」的具体顺服，从以下类型中选一项：①向一位家人承认一个具体的错并请求饶恕；②停止一项需要说谎或夸大的业务/做事方式；③明确加入一个小组并参加第一次聚会。写下完成时间。",
      "content_status": "reviewed"
    },
    "S7_transmit": {
      "label": "传",
      "prompt": "本周要把什么传给别人？",
      "content": "本周约一位肢体，用 20 分钟带他走一遍七步法（就用本周的经文与歌曲），下次聚会时互相回报各自的「行」与「传」完成了没有。",
      "content_status": "reviewed"
    }
  },
  "life_practice": "本周完成一项已知道却拖延的具体顺服（向家人认错 / 停止不诚实的做法 / 加入小组），三选一并记录完成时间。",
  "transmission_task": "约一位肢体带他走一遍七步法，下周互相回报「行」与「传」的完成情况。",
  "expected_formation": "门徒完成一项可查验的具体顺服行为（认错/停止不诚实做法/加入小组），并能讲清「先认识主、后撇下」的次序；出现第一次带人走七步法的传递行为。",
  "feedback": {
    "focus": [
      "实践",
      "传递",
      "情感"
    ],
    "question": "三项候选顺服中实际完成了哪一项？带人走七步法时，对方最卡在哪一步？"
  },
  "review_gate": {
    "theological_review": "confirmed",
    "song_relation": "direct_biblical_expression",
    "theological_risk": "辅助歌《一切全献上》单独使用存在道德主义风险——「我全献上」的自述若先于主的呼召，会把跟随变成奉献成本。福音结构必须保持：基督主动呼召 → 门徒回应 → 离开原有生活中心 → 跟随基督 → 进入使命；不得变成「我努力献上自己 → 所以我要跟随」。已在 S2/S3 以「先认识主、后撇下」的次序校正。",
    "practice_conversion": "S6 三选一（向家人认错 / 停止不诚实做法 / 加入小组），行动内容与完成时间（写下完成时间）明确，是三周样本中实践转换层最强的一周。",
    "transmission_conversion": "S7 要求带一位肢体走一遍七步法并互报「行」与「传」完成情况——传递转换层从「讲给人听」升级为「复制流程」，是 MM23/RP 方向的第一代传递。",
    "note": "主歌《耶稣呼召》Confirmed；辅助歌《一切全献上》保持 Under Review，其使用次序待人工复查。"
  },
  "provenance": {
    "source_system": "mos-sermon-2027",
    "source_id": "2027-W03",
    "source_field": "经文中心+神学与福音辨识+处境辨识",
    "copy_policy": "derived_draft",
    "note": "单元内容为 MOS-MUSIC 基于正式释经的样本编排。"
  }
}
