{
  "unit_id": "MUS-U-2027-W04",
  "annual_id": "MOS-MUSIC-ANNUAL-2027",
  "mos_week": "W04",
  "bible_passage": "路5:27–32",
  "core_truth": "耶稣来，是寻找并呼召罪人悔改；祂主动进入罪人的场所，跟随祂的人因此被带进祂寻找罪人的工作里。",
  "theology": "神如同医生主动走近病人，在基督里寻找失丧者，而不是等合格者前来。人的问题不只是明显的罪，更是自义——把「分别」变成「隔离」，甚至替神决定谁配被接纳。基督以自己的身体承担了那道隔离（弗2:14–16），祂受死正是「召罪人悔改」的实现。因此被召的人立刻进入召他者的工作：走近不等于认同罪，也不取消悔改（路5:32 同时说「召罪人」与「悔改」）。教会被召，就是要活出「罪人可以在这里被接纳并悔改」的事实。",
  "music_theme": [
    "MM08",
    "MM20"
  ],
  "core_song": "MUS-S-0001",
  "song_selection_rationale": "顺序：经文真理（耶稣寻找并呼召罪人、跟随者被带进这工作）→ 神学（恩典先到罪人，同席而不认同罪）→ MM08 跟随基督 + MM20 爱邻舍 → 功能（TR/CO/LI）→《奇异恩典》。歌的第一人称「前我失丧，今被寻回」正是利未所经历的，「基督的寻找与拯救」直接对应经文中心「寻找并呼召罪人」；歌曲本身承接的是 TR/EM，「走近一个具体的人」由 S6 承担（Phase 2A Finding 01/02）。",
  "music_function": {
    "primary": "EM",
    "secondary": [
      "TR",
      "CO",
      "LI"
    ]
  },
  "seven_step_method": {
    "S1_read": {
      "label": "读",
      "prompt": "阅读或聆听本周经文，先不急着应用。",
      "content": "读路5:27–32：分四步读——①耶稣出去，「看见」一个税吏名叫利未，对他说「你跟从我来」；②利未就撇下所有的，起来跟从了耶稣；③利未在自己家里为耶稣大摆筵席，同席的「有许多税吏和别的罪人」；④法利赛人与文士发怨言，耶稣回答「无病的人用不着医生……我来本不是召义人悔改，乃是召罪人悔改」。",
      "content_status": "reviewed"
    },
    "S2_understand": {
      "label": "明",
      "prompt": "这段经文究竟教导什么？",
      "content": "耶稣的「看见」是主动的寻找与拣选，不看人的资格——利未是当时被宗教群体排除的税吏。被恩典得着的人第一件事不是把自己藏起来，而是把主带进自己的圈子（设筵席）。同席之争的焦点不是吃饭，而是「谁配被接纳」：自义使人以距离为圣洁，并替神决定谁能坐席。耶稣用「医生与病人」定义自己的使命——走近不等于认同罪，也不取消悔改（5:32 同时说「召罪人」与「悔改」）。",
      "content_status": "reviewed"
    },
    "S3_sing": {
      "label": "唱",
      "prompt": "通过歌曲表达已经理解的真理。",
      "content": "唱《奇异恩典》第一、二节（歌词见教会诗本或授权来源）：把自己放进「前我失丧，今被寻回」的第一人称里——这正是利未所经历的。唱之前先问一句：如果我是那个坐在税关上的人，我会被邀请坐席吗？唱完之后再问一句：今天还有谁没有被邀请？",
      "content_status": "reviewed"
    },
    "S4_remember": {
      "label": "记",
      "prompt": "本周希望门徒记住什么？",
      "content": "记住一句话：「我是需要医生的病人，别人也是。」（对应经文：路5:31–32）",
      "content_status": "reviewed"
    },
    "S5_feel": {
      "label": "感",
      "prompt": "真理应该形成怎样的情感回应？",
      "content": "让真理塑造的情感是：对自己蒙恩的谦卑（我原是被寻回的罪人）与对被排斥者的怜悯。警惕两种假情感：一是把「唱得很感动」当作已经接纳了人；二是用「我们都是罪人」的空话，掩盖自己其实仍不想坐到那个人旁边。",
      "content_status": "reviewed"
    },
    "S6_act": {
      "label": "行",
      "prompt": "本周要完成的一个具体行动。",
      "content": "本周主动走近一位「平时被群体忽略、或你自己不想主动靠近」的具体的人：向一位曾因离婚、成瘾、财务失败、服刑经历被隐性边缘的弟兄姊妹（或不与你同背景、同圈层的人）发出一次具体邀请——约他吃饭或喝茶，或本周坐到他旁边认真聆听三十分钟，并明确说一句「我们欢迎你」。本周内完成，写下对象名字与完成时间；不先问「别人怎么看」，先问「基督会走近谁」；下周在小组或伙伴面前报告完成情况。",
      "content_status": "reviewed"
    },
    "S7_transmit": {
      "label": "传",
      "prompt": "本周要把什么传给别人？",
      "content": "本周带一位肢体（或家人）走一遍七步法，就用本周的路5:27–32与《奇异恩典》。不要只讲道理，一起回答一句「这一周我要走近谁？」。下周见面时互相回报：他走近了谁、你走近了谁、结果如何。",
      "content_status": "reviewed"
    }
  },
  "life_practice": "本周向一位被忽略或被隐性边缘的人作一次具体走近（约餐、换座或聆听三十分钟），并明确说一句「我们欢迎你」，完成时间写下来。",
  "transmission_task": "带一位肢体或家人走一遍七步法（本周经文与歌曲），下周互相回报各自走近了谁、结果如何。",
  "expected_formation": "门徒完成一项可查验的走近行动（约餐／换座／聆听并说「我们欢迎你」），能说清「我是需要医生的病人，别人也是」；并第一次以七步法带人走一遍，把「这一周我要走近谁」传下去。",
  "feedback": {
    "focus": [
      "实践",
      "群体",
      "传递"
    ],
    "question": "本周实际走近的那一位是谁？说出「我们欢迎你」之后，对方和你的反应各是什么？带人走七步法时，对方最卡在哪一步？"
  },
  "review_gate": {
    "theological_review": "confirmed",
    "song_relation": "direct_biblical_expression",
    "theological_risk": "双向风险：①自义式圣洁——以「保持距离」当作圣洁，替神决定谁配坐席（法利赛人的错）；②反向的「什么都接纳」——把接纳当成不必悔改（路5:32 同时说「召罪人」与「悔改」）。走近不等于认同罪，也不取消悔改。",
    "practice_conversion": "S6 四要素齐备：对象（一位被忽略或被隐性边缘的具体的人）、内容（发出邀请／约餐／换座／聆听三十分钟并说「我们欢迎你」）、时间（本周内完成，写下日期）、方式（写下对象与完成时间，下周在小组或伙伴面前互报）。",
    "transmission_conversion": "S7 三要素齐备：对象（一位肢体或家人）、方式（带他走一遍七步法，用本周经文与歌曲，一起回答「这一周我要走近谁」）、验证（下周见面互相回报各自走近了谁、结果如何）。传递的是真理与形成，不是音乐文件。",
    "note": "主歌《奇异恩典》：Skill 判定 direct_biblical_expression + Core Candidate，无 HIGH 风险，S6/S7 成立。Tier A 与本周适配裁决相互独立，歌曲 review_status 仍为 under_review。待人工复核三项：①第一人称见证与路5:27–32 的关系等级；②音乐库仅 5 首、无合适辅助歌；③LQ01 与本周经文属跨线配对。"
  },
  "provenance": {
    "source_system": "mos-sermon-2027",
    "source_id": "2027-W04",
    "source_field": "经文中心+神学与福音辨识+处境辨识",
    "copy_policy": "derived_draft",
    "note": "单元内容为 MOS-MUSIC 基于正式释经的编排；歌曲辨识由 mos-music-song-discernment@1.0.0（Frozen）产生。"
  }
}
