{
  "unit_id": "MUS-U-2027-W01",
  "annual_id": "MOS-MUSIC-ANNUAL-2027",
  "mos_week": "W01",
  "bible_passage": "路4:14–21",
  "core_truth": "耶稣是被圣灵膏立、被差遣的那一位；祂以「今天」宣告：神悦纳人的恩典与释放，已经在祂身上开始。",
  "theology": "神是主动施恩、主动膏立、主动差遣、主动使应许应验的神；救恩的每一步都从祂开始。人是被寻访、被释放的对象，而不是先为神做事的人。讲章若把重心从基督移到「我们要做事」，就丢失了本段的福音。",
  "music_theme": [
    "MM05"
  ],
  "core_song": "MUS-S-0001",
  "song_selection_rationale": "顺序：经文真理（受膏者宣告恩典释放临到）→ 神学（恩典先行）→ MM05 → 功能（EM：被寻回的感恩）→ 《奇异恩典》。「前我失丧今被寻回」正是「祂先临到被掳者」的会众语言；辅助《普世欢腾》把「今天应验」唱成喜乐宣告。",
  "music_function": {
    "primary": "EM",
    "secondary": [
      "TR",
      "PR"
    ]
  },
  "seven_step_method": {
    "S1_read": {
      "label": "读",
      "prompt": "阅读或聆听本周经文，先不急着应用。",
      "content": "读路4:14–21两遍：第一遍留意耶稣在做什么（进会堂、读经、坐下）；第二遍只读4:18–19，数一数主的使命共有几件，注意「今天的」这个词。",
      "content_status": "reviewed"
    },
    "S2_understand": {
      "label": "明",
      "prompt": "这段经文究竟教导什么？",
      "content": "这段经文的中心不是「我们要传福音」，而是「耶稣是谁」：祂是旧约应许的受膏者（赛61），祂宣告神的恩典与释放已经开始。恩典的次序是——祂先临到贫穷、被掳、瞎眼、受压制的人，然后才谈跟随与服事。把「今天」用在自身：不是将来某天神可能悦纳我，而是祂已在基督里悦纳属祂的人。",
      "content_status": "reviewed"
    },
    "S3_sing": {
      "label": "唱",
      "prompt": "通过歌曲表达已经理解的真理。",
      "content": "唱《奇异恩典》第一节（歌词见教会诗本或授权来源，本系统不托管译文）：它讲的正是「前失丧—被寻回」的恩典次序，与路4章「祂先临到被掳者」同一条线。唱完后再唱《普世欢腾》副歌「主已来临」，把「今天应验」唱成喜乐的宣告。",
      "content_status": "reviewed"
    },
    "S4_remember": {
      "label": "记",
      "prompt": "本周希望门徒记住什么？",
      "content": "记住一句话：「恩典先行：我先被寻回，然后才开始跟随。」（对应经文：路4:18–19）",
      "content_status": "reviewed"
    },
    "S5_feel": {
      "label": "感",
      "prompt": "真理应该形成怎样的情感回应？",
      "content": "让真理塑造的情感是：被寻回的感恩与安息——不是「我要更努力才配」的焦虑，也不是廉价兴奋，而是「祂已经先行动了」的安定。若唱时只有情绪没有感恩的指向，回到 S2 的恩典次序重读。",
      "content_status": "reviewed"
    },
    "S6_act": {
      "label": "行",
      "prompt": "本周要完成的一个具体行动。",
      "content": "选一件你一直「等神替我解决」的具体难处（如某段关系、某项工作压力），本周改写成一句感恩祷告：「感谢你在基督里已经悦纳我；这件事也在你手里。」写下来，并在这周至少完整祷告三次。",
      "content_status": "reviewed"
    },
    "S7_transmit": {
      "label": "传",
      "prompt": "本周要把什么传给别人？",
      "content": "把路4:18–19 中主的使命用自己的话讲给一位家人听（两分钟以内），并约他下周和你一起唱《奇异恩典》第一节。",
      "content_status": "reviewed"
    }
  },
  "life_practice": "本周把一件「等神解决」的具体难处改写成感恩交托的祷告，并至少完整祷告三次。",
  "transmission_task": "向一位家人用两分钟讲述路4:18–19 的使命宣告，并约他下周一起唱第一节。",
  "expected_formation": "门徒从「把耶稣当工具」转向「先领受恩典」：一周内出现一次具体的感恩交托祷告行为；口头上能复述「恩典先行」这句话。",
  "feedback": {
    "focus": [
      "情感",
      "记住",
      "实践"
    ],
    "question": "唱完这首歌后，组员是否能把「我先被寻回，然后才开始跟随」说清楚？交托祷告是否真的发生了三次？"
  },
  "review_gate": {
    "theological_review": "confirmed",
    "song_relation": "direct_biblical_expression",
    "theological_risk": null,
    "practice_conversion": "S6 指定具体难处（某段关系/工作压力）、行动内容（改写成感恩交托祷告）与可数频率（本周至少完整祷告三次）——歌曲不自动产生行为，由该指令完成实践转换。",
    "transmission_conversion": "S7 要求向家人讲述路4:18–19 的使命宣告，并约对方下周同唱《奇异恩典》第一节——真理传递与音乐传递（祖孙同唱）双通道。",
    "note": "主歌《奇异恩典》Confirmed：真理表达（前失丧今被寻回）、恩典主题、感恩、祷告（S6）、实践、传递（S7）六项成立；中文译本版本选择待人工确认（本系统不托管译文）。"
  },
  "provenance": {
    "source_system": "mos-sermon-2027",
    "source_id": "2027-W01",
    "source_field": "经文中心+神学与福音辨识",
    "copy_policy": "derived_draft",
    "note": "单元内容为 MOS-MUSIC 基于正式释经的样本编排。"
  }
}
